{
  "version": 0,
  "kind": "modele-menace",
  "spec": "CT-7",
  "spec_version": "0.1",
  "date": "2026-10-26",
  "components": [
    {
      "id": "hote_agent",
      "name": "Hôte de l'agent",
      "holds": "Le processus de l'agent, l'hôte (application, cadre ou SDK) et leurs identifiants propres ; aucun accès au stockage ni au signataire (CT-2 EX-3.2).",
      "trust": "Aucune : tout ce qu'il envoie est une donnée d'attaquant (CT-2 §3.3)."
    },
    {
      "id": "mandataire_mcp",
      "name": "Mandataire MCP",
      "holds": "Le frontal MCP du démon : liste servie, définitions, identifiants propres vers les serveurs d'outils (CT-2 EX-4.40).",
      "trust": "Partie de l'enregistreur ; les serveurs d'outils, eux, ne sont pas crus."
    },
    {
      "id": "passerelle_modele",
      "name": "Passerelle du modèle et raccord ICAP",
      "holds": "Les routes, les clés des fournisseurs en mode « propre » (CT-2 EX-5.8), le service ICAP et ses sources admises (CT-2 EX-5.3).",
      "trust": "Partie de l'enregistreur ; le fournisseur et le mandataire ICAP ne sont pas crus."
    },
    {
      "id": "sdk_otel",
      "name": "SDK et ingestion OpenTelemetry (chemin déclaratif)",
      "holds": "Les prises du SDK et le point d'entrée OTLP, les jetons des sources (CT-2 EX-6.37).",
      "trust": "Déclaratif : l'événement prouve une déclaration, pas l'acte (CT-2 §6.7)."
    },
    {
      "id": "ecrivain_stockage",
      "name": "Écrivain, stockage et bail",
      "holds": "Les segments, le journal d'intention, les pièces, le journal d'exploitation, le bail et son époque (CT-2 §12, §13).",
      "trust": "Pleine pour la chaîne qu'il écrit ; bornée par les ancres (CT-1 §10.9)."
    },
    {
      "id": "worm_gel",
      "name": "Copies WORM et gel juridique",
      "holds": "Les copies verrouillées, le registre des copies, le registre des gels et les rôles du support (CT-2 EX-18.9).",
      "trust": "Le support fait foi de la rétention qu'il rend ; les registres sont déclaratifs (CT-2 EX-12.41)."
    },
    {
      "id": "cles",
      "name": "Clés par classe de garde",
      "holds": "Toutes les clés et tous les secrets de l'inventaire de 4.2, chacun dans sa classe A à D (CT-2 §11.2).",
      "trust": "Celle de la classe : la plus forte en classe A, aucune garantie en classe D."
    },
    {
      "id": "approbation_console",
      "name": "Service d'approbation et console",
      "holds": "La politique, les tickets, l'annuaire, les identifiants du canal ; aucune clé d'approbateur (CT-3 EX-3.3, CT-3 EX-3.4).",
      "trust": "Canal authentifié ; réponses non signées ; console non fiable pour l'approbateur (CT-3 §3.1)."
    },
    {
      "id": "registre",
      "name": "Registre (validateurs, RPC, contrats, administrateur, gouvernance, trésorerie)",
      "holds": "La chaîne de noorcore, les contrats, les clés de validateur, d'administrateur, de gouvernance et de trésorerie (CT-4 §3.1).",
      "trust": "Rien n'est cru sans certificat de commit vérifié contre le jeu du réviseur (CT-6 §11)."
    },
    {
      "id": "ancrage",
      "name": "Composant d'ancrage, prestataires RFC 3161, calendriers OpenTimestamps",
      "holds": "La file, les identifiants d'accès aux prestataires, les jetons et preuves acquis (CT-5 §1).",
      "trust": "Aucune clé Ed25519 ni clé de chaîne ; les prestataires sont crus seulement sous H4 (CT-6 §3.5)."
    },
    {
      "id": "verificateur",
      "name": "Vérificateur et ancres de confiance du réviseur",
      "holds": "Le code du vérificateur, le fichier d'ancres du réviseur, le fichier d'en-têtes Bitcoin (CT-6 §4).",
      "trust": "Il ne croit que son code, les primitives et les ancres du réviseur (CT-6 §3.1)."
    },
    {
      "id": "exploitant",
      "name": "Exploitant NOORTRACE",
      "holds": "L'instance du registre, ses clés d'exploitation, le manifeste d'instance, la publication du logiciel (CT-4 §3.1). Ne détient ni le journal, ni ses copies, ni les pièces, ni CLE-1 ou CLE-2, créées et gardées par le client (4.2) ; le registre ne reçoit que des identifiants, des clés publiques, des empreintes, des adresses d'approbateurs et leurs signatures, jamais d'événement ni de pièce (8.6, CT-7 EX-8.10).",
      "trust": "Adversaire « fournisseur » de CT-6 §3.4 : rien de ce qu'il sert n'est cru sans recoupement."
    },
    {
      "id": "administrateur_client",
      "name": "Administrateur du client",
      "holds": "La configuration, la politique, l'exploitation de l'enregistreur et du service, l'export des dossiers, l'attestation de périmètre.",
      "trust": "Adversaire « opérateur » de CT-6 §3.4 ; ce qu'il déclare reste déclaré."
    },
    {
      "id": "reseau",
      "name": "Réseau",
      "holds": "Les liens entre l'hôte, le démon, les serveurs d'outils, les fournisseurs, les prestataires, le registre et la console.",
      "trust": "Aucune : TLS ou prise locale authentifiée partout où un secret ou une décision circule."
    }
  ],
  "source_tables": [
    {
      "spec": "CT-2",
      "section": "18.3",
      "rows": 5
    },
    {
      "spec": "CT-3",
      "section": "3.5",
      "rows": 10
    },
    {
      "spec": "CT-3",
      "section": "14.2",
      "rows": 10
    },
    {
      "spec": "CT-3",
      "section": "14.4",
      "rows": 5
    },
    {
      "spec": "CT-3",
      "section": "14.5",
      "rows": 7
    },
    {
      "spec": "CT-3",
      "section": "14.7",
      "rows": 10
    },
    {
      "spec": "CT-3",
      "section": "14.8",
      "rows": 8
    },
    {
      "spec": "CT-3",
      "section": "14.9",
      "rows": 15
    },
    {
      "spec": "CT-4",
      "section": "3.5",
      "rows": 9
    },
    {
      "spec": "CT-4",
      "section": "12",
      "rows": 18
    },
    {
      "spec": "CT-5",
      "section": "3.4",
      "rows": 6
    },
    {
      "spec": "CT-5",
      "section": "13",
      "rows": 13
    },
    {
      "spec": "CT-6",
      "section": "3.4",
      "rows": 6
    },
    {
      "spec": "CT-6",
      "section": "15.5",
      "rows": 23
    },
    {
      "spec": "CT-2",
      "section": "18.5",
      "rows": 6
    }
  ],
  "threats": [
    {
      "id": "MN-1",
      "component": "hote_agent",
      "stride": [
        "repudiation",
        "elevation_de_privilege"
      ],
      "actor": "L'agent ou tout code de l'hôte qui a un accès réseau propre.",
      "asset": "Complétude du journal : tout appel d'outil d'un serveur configuré passe par le mandataire.",
      "effect": "Un appel atteint le serveur d'outils sans l'enregistreur ; aucun événement n'existe et aucun dossier ne peut montrer cette absence.",
      "response": {
        "text": "Serveurs stdio lancés par le démon et serveurs HTTP filtrés pour que seul le démon les joigne (CT-2 EX-4.1, CT-2 EX-3.4, CT-2 §4.9) ; agent sans les identifiants de l'enregistreur (CT-2 EX-4.40, CT-2 EX-4.41) ; règles de sortie et exceptions déclarées par l'attestation de périmètre (CT-7 §7) ; essai de sortie annuel (CT-7 EX-3.13).",
        "refs": [
          "CT-2 EX-4.1",
          "CT-2 EX-3.4",
          "CT-2 §4.9",
          "CT-2 EX-4.40",
          "CT-2 EX-4.41",
          "CT-7 §7",
          "CT-7 EX-3.13"
        ]
      },
      "detection": {
        "text": "Journal du pare-feu des tentatives de connexion directe (CT-2 §4.9, point 5) ; essai de sortie (CT-7 EX-3.13) ; le rapport de CT-6 dit « déclaré par » pour le périmètre (CT-7 §7).",
        "refs": [
          "CT-2 §4.9",
          "CT-7 EX-3.13",
          "CT-7 §7"
        ]
      },
      "residual": {
        "text": "Un acte hors du périmètre déclaré n'est jamais prouvé absent : le journal prouve ce qui est passé, pas que rien ne l'a contourné (CT-1 §15).",
        "accepted_risk": {
          "id": "RA-1",
          "name": "Complétude non prouvable par la chaîne",
          "bound": "Bornée aux voies que le pare-feu déclaré laisse ouvertes et aux exceptions listées dans l'attestation de périmètre",
          "owner": "client"
        }
      },
      "test": "Le test échoue si la réponse est retirée : dans la démonstration de référence, un conteneur d'agent tente de joindre directement le serveur d'outils HTTP ; la connexion doit échouer et figurer au journal du pare-feu ; sans la règle de sortie, la connexion aboutit et le test échoue.",
      "sources": [
        {
          "spec": "CT-3",
          "section": "3.5",
          "row": "Agent (et hôte)"
        },
        {
          "spec": "CT-3",
          "section": "14.7",
          "row": "Agent"
        }
      ]
    },
    {
      "id": "MN-2",
      "component": "hote_agent",
      "stride": [
        "usurpation",
        "repudiation"
      ],
      "actor": "L'agent, qui écrit ce qu'il veut dans `_meta` et dans sa délégation déclarée.",
      "asset": "`delegation` de l'événement et portée des règles d'approbation.",
      "effect": "Un appel est attribué à une autre personne, ou profite de la fenêtre d'approbation d'un autre demandeur.",
      "response": {
        "text": "`launched_by` vient de la configuration de la connexion d'hôte, jamais de l'hôte (CT-2 EX-7.2, CT-2 EX-7.3) ; l'évaluation ne lit que `launched_by` configuré (CT-3 EX-3.5) ; portée des fenêtres par demandeur et par outil (CT-3 EX-5.2).",
        "refs": [
          "CT-2 EX-7.2",
          "CT-2 EX-7.3",
          "CT-3 EX-3.5",
          "CT-3 EX-5.2"
        ]
      },
      "detection": {
        "text": "Ligne `delegation_refused` du journal d'exploitation (CT-2 EX-17.2).",
        "refs": [
          "CT-2 EX-17.2"
        ]
      },
      "residual": {
        "text": "`run_id` et `on_behalf_of` restent déclaratifs (CT-2 §7.2).",
        "accepted_risk": {
          "id": "RA-2",
          "name": "Délégation déclarée par l'hôte",
          "bound": "Limitée à `run_id` et `on_behalf_of`, que ni la politique ni le contrôle 7 ne lisent",
          "owner": "client"
        }
      },